<?xml version="1.0"?>
<xs:schema xmlns:xs="http://www.w3.org/2001/XMLSchema" targetNamespace="http://www.w3schools.com" xmlns="http://www.w3schools.com" elementFormDefault="qualified">
  <xs:element name="Universities">
    <xs:complexType>
      <xs:sequence>
        <xs:element name="University" maxOccurs="unbounded" minOccurs="0">
          <xs:complexType>
            <xs:sequence>
              <xs:element type="xs:string" name="name"/>
              <xs:element type="xs:string" name="image"/>
              <xs:element name="schools">
                <xs:complexType>
                  <xs:sequence>
                    <xs:element name="school" maxOccurs="unbounded" minOccurs="0">
                      <xs:complexType>
                        <xs:sequence>
                          <xs:element type="xs:string" name="schoolname"/>
                          <xs:element name="majors">
                            <xs:complexType>
                              <xs:sequence>
                                <xs:element name="major" maxOccurs="unbounded" minOccurs="0">
                                  <xs:complexType>
                                    <xs:sequence>
                                      <xs:element type="xs:string" name="majorname"/>
                                    </xs:sequence>
                                  </xs:complexType>
                                </xs:element>
                              </xs:sequence>
                            </xs:complexType>
                          </xs:element>
                        </xs:sequence>
                      </xs:complexType>
                    </xs:element>
                  </xs:sequence>
                </xs:complexType>
              </xs:element>
            </xs:sequence>
          </xs:complexType>
        </xs:element>
      </xs:sequence>
    </xs:complexType>
  </xs:element>
</xs:schema>